PMID,Title,Abstract,Journal,Date,Types,DOI,PubMed_Link,PMC_Link
36152907,"A self-healing, magnetic and injectable biopolymer hydrogel generated by dual cross-linking for drug delivery and bone repair.","Injectable hydrogels based on various functional biocompatible materials have made rapid progress in the field of bone repair. In this study, a self-healing and injectable polysaccharide-based hydrogel was prepared for bone tissue engineering. The hydrogel was made of carboxymethyl chitosan (CMCS) and calcium pre-cross-linked oxidized gellan gum (OGG) cross-linked by the Schiff-base reaction. Meanwhile, magnetic hydroxyapatite/gelatin microspheres (MHGMs) were prepared by the emulsion cross-linking method. The antibacterial drugs, tetracycline hydrochloride (TH) and silver sulfadiazine (AgSD), were embedded into the MHGMs. To improve the mechanical and biological properties of the hydrogels, composite hydrogels were prepared by compounding hydroxyapatite (HAp) and drug-embedded MHGMs. The physical, chemical, mechanical and rheological properties of the composite hydrogels were characterized, as well as in vitro antibacterial tests and biocompatibility assays, respectively. Our results showed that the composite hydrogel with 6% (w/v) HAp and 10 mg/mL MHGMs exhibited good magnetic responsiveness, self-healing and injectability. Compared with the pure hydrogel, the composite hydrogel showed a 38.8% reduction in gelation time (196 to 120 s), a 65.6% decrease in swelling rate (39.4 to 13.6), a 51.9% increase in mass residual after degradation (79.5 to 120.8%), and a 143.7% increase in maximum compressive stress (53.6 to 130.6 KPa). In addition, this composite hydrogel showed good drug retardation properties and antibacterial effects against both S. aureus and E. coli. CCK-8 assay showed that composite hydrogel maintained high cell viability (> 87%) and rapid cell proliferation after 3 days, indicating that this smart hydrogel is expected to be an alternative scaffold for drug delivery and bone regeneration. STATEMENT OF SIGNIFICANCE: Biopolymer hydrogels have been considered as the promising materials for the treatment of tissue engineering and drug delivery. Injectable hydrogels with and self-healing properties and responsiveness to external stimuli have been extensively investigated as cell scaffolds and bone defects, due to their diversity and prolonged lifetime. Magnetism has also been involved in biomedical applications and played significant roles in targeted drug delivery and anti-cancer therapy. We speculate that development of dual cross-linked hydrogels basing biopolymers with multi-functionalities, such as injectable, self-healing, magnetic and anti-bacterial properties, would greatly broaden the application for bone tissue regeneration and drug delivery.",Acta biomaterialia,2022 Nov,"Journal Article; Research Support, Non-U.S. Gov't",S1742-7061(22)00598-0,https://pubmed.ncbi.nlm.nih.gov/36152907/,
35562007,Robust gelatin hydrogels for local sustained release of bupivacaine following spinal surgery.,"Adequate treatment of pain arising from spinal surgery is a major clinical challenge. Opioids are the mainstay of current treatment methods, but the frequency and severity of their side effects display a clear need for opioid-free analgesia. Local anesthetics have been encapsulated into sustained-release drug delivery systems to provide postoperative pain relief. However, these formulations are limited by rapid diffusion out of the surgical site. To overcome this limitation, we synthesized ring-shaped hydrogels incorporating bupivacaine, designed to be co-implanted with pedicle screws during spinal surgery. Hydrogels were prepared by riboflavin-mediated crosslinking of gelatin functionalized with tyramine moieties. Additionally, oxidized beta-cyclodextrin was introduced into the hydrogel formulation to form dynamic bonds with tyramine functionalities, which enables self-healing behavior and resistance to shear. Feasibility of hydrogel implantation combined with pedicle screws was qualitatively assessed in cadaveric sheep as a model for instrumented spinal surgery. The in-situ crystallization of bupivacaine within the hydrogel matrix provided a moderate burst decrease and sustained release that exceeded 72 hours in vitro. The use of bupivacaine crystals decreased drug-induced cytotoxicity in vitro compared to bupivacaine HCl. Thus, the presented robust hydrogel formulation provides promising properties to enable the stationary release of non-opioid analgesics following spinal surgery. STATEMENT OF SIGNIFICANCE: Currently, postoperative pain following spinal surgery is mainly treated with opioids. However, the use of opioids is associated with several side effects including addiction. Here we developed robust and cytocompatible gelatin hydrogels, prepared via riboflavin-mediated photocrosslinking, that can withstand orthopedic implantation. The implantability was confirmed in cadaveric instrumented spinal surgery. Further, hydrogels were loaded with bupivacaine crystals to provide sustained release beyond 72 hours in vitro. The use of crystallized bupivacaine decreased cytotoxicity compared to bupivacaine HCl. The present formulation can aid in enabling opioid-free analgesia following instrumented spinal surgery.",Acta biomaterialia,2022 Jul 1,"Journal Article; Research Support, Non-U.S. Gov't",S1742-7061(22)00276-8,https://pubmed.ncbi.nlm.nih.gov/35562007/,
35429669,NIR-activated multi-hit therapeutic Ag(2)S quantum dot-based hydrogel for healing of bacteria-infected wounds.,"Hydrogel dressings are highly biocompatible and can maintain a moist wound environment, suggesting constructing an efficient multi-modal antibacterial hydrogel platform is a promising strategy for treating bacterial wound infections. In this work, a composite Ag(2)S quantum dot/mSiO(2) NPs hydrogel (NP hydrogel) with antibacterial ability was constructed by incorporating Ag(2)S quantum dots (QDs) modified by mesoporous silica (mSiO(2)) into the network structure of 3-(trimethoxylmethosilyl) propyl methacrylate based on free radical polymerization. The NP hydrogel showed outstanding controllable photothermal and photodynamic characteristics under 808 nm near infrared (NIR) light irradiation, with a photothermal conversion efficiency of 57.3%. Additionally, the release of Ag(+) could be controlled by the inherent volume change of the NP hydrogel made of N-isopropylacrylamide (NIPAAm) and acrylamide (AAm) during NIR laser exposure, with the embedded Ag(2)S QDs working as a reservoir to release Ag(+) continuously from the hydrogel matrix to achieve bactericidal activity. The synergetic effects between hyperthermia, radical oxygen species, and Ag(+) released under NIR radiation endowed the NP hydrogel with prominent antibacterial properties against Escherichia coli (E. coli) and methicillin-resistant Staphylococcus aureus (MRSA), with an inhibition rate of 99.7% and 99.8%, respectively. In vivo wound healing experiments indicated that the NP hydrogel could enhance bacterial clearance, increase collagen coverage area and up-regulate VEGF expression, exhibiting high biocompatibility. Overall, this study proposed an efficient and highly biocompatible multi-modal therapeutic nanohydrogel, opening up a new way for developing broad-spectrum antibacterial wound dressings to treat bacterial wound infections. STATEMENT OF SIGNIFICANCE: Bacterial wound infection is still one of the most difficult medical problems. In this work, a stimulating NIR-responsive hydrogel encapsulating functional Ag(2)S QDs was prepared, which showed high photothermal conversion efficiency (57.3%) and outstanding antibacterial ability under 808 nm NIR laser, killing 99.7% and 99.8% of E. coli and MRSA in 4 min, respectively. During NIR light irradiation, the release rate of Ag(+) could be regulated by the intrinsic volume transition of the hydrogel, leading to remarkable antibacterial properties in vitro and in vivo under the combined action of hyperthermia, radical oxygen species and Ag(+) released. This study proposed a novel multi-modal therapeutic nanohydrogel, opening up a new way for developing broad-spectrum antibacterial wound dressings to treat bacterial wound infections.",Acta biomaterialia,2022 Jun,"Journal Article; Research Support, Non-U.S. Gov't",S1742-7061(22)00215-X,https://pubmed.ncbi.nlm.nih.gov/35429669/,
35421616,Disulfide-Mediated Elongation of Amyloid Fibrils of alpha-Synuclein For Use in Producing Self-Healing Hydrogel and Dye-Absorbing Aerogel.,"Due to their mechanical robustness, biocompatibility, and nanoscale size, amyloid fibrils (AFs) have been considered as a potential nanomaterial for biological applications. Unfortunately, however, AFs are usually not fully extended because of their pre-mature breakage, which hampers their use to generate biocompatible suprastructures, although the amounts of AFs could be amplified via their self-propagation property. Here, we have demonstrated the full extension of AFs of alpha-synuclein (alphaS) by introducing a cysteine residue to its C-terminus which prevents the shear-induced fragmentation of AFs via site-directed disulfide bond formation on the exposed surface of AFs. These heat- and cold-resistant elongated AFs were entangled into self-healable hydrogels through a mild disulfide-exchange process in the presence of tris(2-carboxyethyl) phosphine, which subsequently developed into dye-absorbing aerogels upon freeze-drying without collapsing the three-dimensional internal fibrillar network. The resulting alphaS aerogel with high porosity and increased surface area was shown to be capable of absorbing both hydrophilic and hydrophobic substances. In addition, the aerogel was further engineered with 8-arm polyethylene glycol containing a sulfhydryl group to increase its drug loading capacity and protease susceptibility for drug unloading. The elongated AFs, therefore, have been suggested to play a pivotal component for the development of bio-nano-matrix for diverse biological applications including drug delivery, tissue engineering, and environmental remediation. STATEMENT OF SIGNIFICANCE: Due to accurate protein self-assembly process, alpha-synuclein forms an amyloid fibril which are the major component of Lewy bodies. In general, alpha-synuclein amyloid fibrils break under thermal fluctuations as these nanofibrils elongate to reach certain length. In this study, we have demonstrated the full extension of alpha-synuclein amyloid fibrils by introducing a cysteine residue to its C-terminus by forming site-directed disulfide bonds on the exposed surface of amyloid fibrils for the first time. The resulting elongated amyloid fibrils were mechanically robust and stable. By using elongated amyloid fibrils, we have made self-healable amyloid fibril hydrogel and dye-absorbing aerogel.",Acta biomaterialia,2022 Jun,"Journal Article; Research Support, Non-U.S. Gov't",S1742-7061(22)00217-3,https://pubmed.ncbi.nlm.nih.gov/35421616/,
35398268,Nano-hydroxyapatite-evoked immune response synchronized with controllable immune adjuvant release for strengthening melanoma-specific growth inhibition.,"Concerns about the potential systematic toxicity limit the extensive application of traditional therapeutic drugs for melanoma therapy, nano-hydroxyapatite (nHA) with good biocompatibility and anti-tumor ability could be an alternative choice. In this study, nHA was employed as an anti-tumor biomaterial due to its tumor-specific toxicity. Meanwhile, granulocyte-macrophage colony-stimulating factor (GM-CSF) served as the immune adjuvant to activate the immune response. The delivery platform was fabricated by co-encapsulation of both nHA and GM-CSF into a biocompatible thermosensitive PLGA-PEG-PLGA hydrogel. The results showed that the bio-activities of nHA and GM-CSF could be well-maintained within the hydrogel. Interestingly, the addition of nHA could attenuate the burst release of GM-CSF due to possible protein absorption capacity of nHA, which is beneficial for GM-CSF sustainable release at the tumor site, achieving boosted and prolonged anti-tumor immunity. The in vitro and in vivo data demonstrated that nHA/GM-CSF hydrogel exhibited greater potency to inhibit tumor growth via enhanced CD8(+) T-cell response compared with hydrogel and nHA hydrogel groups, contributed by the synergistic effects of nHA and GM-CSF. Overall, the strategy combining nHA and immune adjuvant shows great promise, which largely broadens the choice of combinational therapies for melanoma. STATEMENT OF SIGNIFICANCE: Nano-hydroxyapatite (nHA) has been confirmed to specifically inhibit melanoma tumor growth and induce immune response. However, its antitumor efficiency and immunity-evoking capacity are limited. In this study, granulocyte-macrophage colony-stimulating factor (GM-CSF) was introduced to serve as the immune adjuvant. Both of them were encapsulated into a biocompatible thermosensitive PLGA-PEG-PLGA hydrogel. The addition of nHA could attenuate the burst release of GM-CSF due to the interaction with nHA, which is beneficial for GM-CSF sustainable release at tumor site, achieving boosted and prolonged anti-tumor immunity. Anti-tumor immune response could be activated due to the release of tumor-associated antigen and tumor debris induced by the specifically tumor inhibition effect of nHA and GM-CSF. The combination of nHA and GM-CSF could play synergistic inhibiting effect on tumor growth via boosting and prolonging anti-tumor immunity.",Acta biomaterialia,2022 Jun,"Journal Article; Research Support, Non-U.S. Gov't",S1742-7061(22)00201-X,https://pubmed.ncbi.nlm.nih.gov/35398268/,
34774784,Controllable fabrication of alginate/poly-L-ornithine polyelectrolyte complex hydrogel networks as therapeutic drug and cell carriers.,"Polyelectrolyte complex (PEC) hydrogels are advantageous as therapeutic agent and cell carriers. However, due to the weak nature of physical crosslinking, PEC swelling and cargo burst release are easily initiated. Also, most current cell-laden PEC hydrogels are limited to fibers and microcapsules with unfavorable dimensions and structures for practical implantations. To overcome these drawbacks, alginate (Alg)/poly-L-ornithine (PLO) PEC hydrogels are fabricated into microcapsules, fibers, and bulk scaffolds to explore their feasibility as drug and cell carriers. Stable Alg/PLO microcapsules with controllable shapes are obtained through aqueous electrospraying technique, which avoids osmotic shock and prolongs the release time. Model enzyme and nanosized cargos are successfully encapsulated and continuously released for more than 21 days. Alg/PLO PEC fibers are then prepared to encapsulate brown adipose progenitors (BAPs) and Jurkat T cells. The electrostatic interactions between Alg and PLO are found to facilitate the printability and self-support ability of Alg/PLO bioinks. Alg/PLO PEC fibers and scaffolds support cell proliferation, differentiation, and functionalization. These results demonstrate new options for biocompatible PEC hydrogel preparation and improve the understanding of PEC hydrogels as drug and cell carriers. STATEMENT OF SIGNIFICANCE: In this study, the concept of polyelectrolyte complex hydrogel networks as drug and cell carriers has been demonstrated. Their feasibility to achieve sustained drug release and cell functionality was explored, from microcapsules to fibers to three-dimension printed scaffolds. PEC microcapsules with controllable shapes were obtained. Therapeutic drugs can be encapsulated and continuously release for more than 21 days. Benefiting from the dynamic interactions of physically crosslinked PEC, self-healing fibers were achieved. Besides, the electrostatic interactions between polyelectrolytes were found to facilitate the printability and self-support ability of PEC bioinks. The PEC fibers and scaffolds with controllable structure supported cell proliferation, differentiation, and function. The outcome of current research promotes design of new biocompatible PEC hydrogels and potential drug and cell carriers.",Acta biomaterialia,2022 Jan 15,"Journal Article; Research Support, Non-U.S. Gov't",S1742-7061(21)00745-5,https://pubmed.ncbi.nlm.nih.gov/34774784/,
34644612,An interpenetrating and patternable conducting polymer hydrogel for electrically stimulated release of glutamate.,"Recent advances in drug delivery have made it possible to release bioactive agents from neural implants specifically to local tissues. Conducting polymer coatings have been explored as a delivery platform in bioelectronics, however, their utility is restricted by their limited loading capacity and stability. This study presents the fabrication of a stable conducting polymer hydrogel (CPH), comprising the hydrogel gelatin methacrylate (GelMA), and conducting polymer polypyrrole (PPy) for the electrically controlled delivery of glutamate (Glu). The hybrid GelMA/PPy/Glu can be photolithographically patterned and covalently bonded to an electrode. Fourier-transform infrared (FTIR) analysis confirmed the interpenetrating nature of PPy through the GelMA hydrogels. Electrochemical polymerisation of PPy/Glu through the GelMA hydrogels resulted in a significant increase in the charge storage capacity as determined by cyclic voltammetry (CV). Long-term electrochemical and mechanical stability was demonstrated over 1000 CV cycles and extracts of the materials were cytocompatible with SH-SY5Y neuroblastoma cell lines. Release of Glu from the CPH was responsive to electrical stimulation with almost five times the amount of Glu released upon constant reduction (-0.6 V) compared to when no stimulus was applied. Notably, GelMA/PPy/Glu was able to deliver almost 14 times higher amounts of Glu compared to conventional PPy/Glu films. The described CPH coatings are well suited in implantable drug delivery applications and compared to conducting polymer films can deliver higher quantities of drug in response to mild electrical stimulus. STATEMENT OF SIGNIFICANCE: Conducting polymer hydrogels (CPH) have been explored for the electrically controlled release of bioactives from implantable devices. Typically, the conducting polymer component does not fully penetrate the hydrogel. We report, for the first time, a completely interpenetrating CPH allowing for the full benefits of the composite material to be realised, the hydrogels provide a reservoir for drug delivery, and conducting polymer renders the material responsive to electrical stimulation for drug release. We report a CPH for the electrically controlled delivery of glutamate (excitatory neurotransmitter) where several-fold more glutamate can be delivered compared to conducting polymer films. The described CPH coatings are well suited for use in bioelectronic devices to deliver large quantities of drug in response to mild electrical stimulus.",Acta biomaterialia,2022 Jan 1,"Journal Article; Research Support, Non-U.S. Gov't",S1742-7061(21)00677-2,https://pubmed.ncbi.nlm.nih.gov/34644612/,
34217903,Sodium alginate/collagen/stromal cell-derived factor-1 neural scaffold loaded with BMSCs promotes neurological function recovery after traumatic brain injury.,"Stem cell therapy is promising for neural repair in devastating traumatic brain injury (TBI). However, the low survival and differentiation rates of transplanted stem cells are main obstacles to efficient stem cell therapy in TBI. Stromal cell-derived factor-1 (SDF-1) and its receptor CXCR4 are key factors that regulate the survival, recruitment, and differentiation of stem cells. Herein, we synthesized a sodium alginate (SA)/collagen type I (Col)/SDF-1 hydrogel and investigated whether the SA/Col/SDF-1 hydrogel loaded with bone marrow-derived mesenchymal stem cells (BMSCs) had therapeutic effects on a TBI model. Our results showed that the SA/Col/SDF-1 scaffold could stably release SDF-1 and provide biocompatible and biodegradable microenvironment for the survival, migration, and neuronal differentiation of BMSCs in vitro. In a rat model of TBI, the SA/Col/SDF-1 hydrogel loaded with BMSCs significantly ameliorated motor and cognition dysfunction and relieved anxiety and depressive-like behaviors. In addition, the BMSCs/SA/Col/SDF-1 scaffold reduced brain lesions and neuronal cell death and mitigated neuroinflammation. Further studies demonstrated that the BMSCs/SA/Col/SDF-1 hydrogel promoted the migration of BMSCs in the lesions and partly enhanced neurogenesis by activating the SDF-1/CXCR4-mediated FAK/PI3K/AKT pathway. Taken together, our results indicate that the SA/Col/SDF-1 scaffold loaded with BMSCs exerts neuroreparative effects in a TBI rat model, and thus, it may serve as an alternative neural regeneration scaffold for brain injury repair. STATEMENT OF SIGNIFICANCE: Hydrogel facilitates the biological behaviors of transplanted stem cells for tissue regeneration. In this study, we synthesized sodium alginate (SA)/collagen type I (Col)/ scaffold to simultaneously deliver stromal cell derived factor-1 (SDF-1) and bone marrow mesenchymal stem cells (BMSCs) in a rat model of traumatic brain injury (TBI). We found that the SA/Col/SDF-1 hydrogel could continuously release SDF-1 and was conducive to the survival, migration and neuronal differentiation of BMSCs in vitro. In addition, the SA/Col/SDF-1 hydrogel loaded with BMSCs significantly ameliorated neurological deficits, mitigated neuroinflammation, promoted the recruitment of BMSCs and enhanced neurogenesis in TBI partly by activating the SDF-1/CXCR4-mediated FAK/PI3K/AKT pathway. Our results may serve as an alternative neural regeneration strategy for brain injury.",Acta biomaterialia,2021 Sep 1,"Journal Article; Research Support, Non-U.S. Gov't",S1742-7061(21)00412-8,https://pubmed.ncbi.nlm.nih.gov/34217903/,
33713861,A 3-D human model of complex cardiac arrhythmias.,"Cardiac arrhythmias impact over 12 million people globally, with an increasing incidence of acquired arrhythmias. Although animal models have shed light onto fundamental arrhythmic mechanisms, species-specific differences and ethical concerns remain. Current human models using human induced pluripotent stem cell-derived cardiomyocytes (hiPSC-CMs) either lack the higher order tissue organization of the heart or implement unreliable arrhythmia induction techniques. Our goal was to develop a robust model of acquired arrhythmia by disrupting cardiomyocyte cell-cell signaling - one of the hallmarks of complex arrhythmias. Human 3D microtissues were generated by seeding hydrogel-embedded hiPSC-CMs and cardiac fibroblasts into an established microwell system designed to enable active and passive force assessment. Cell-cell signaling was disrupted using methyl-beta cyclodextrin (MBCD), previously shown to disassemble cardiac gap junctions. We demonstrate that arrhythmias were progressive and present in all microtissues within 5 days of treatment. Arrhythmic tissues exhibited reduced conduction velocity, an increased number of distinct action potentials, and reduced action potential cycle length. Arrhythmic tissues also showed significant reduction in contractile force generation, increased beating frequency, and increased passive tension and collagen deposition, in line with fibrosis. A subset of tissues with more complex arrhythmias exhibited 3D spatial differences in action potential propagation. Pharmacological and electrical defibrillation was successful. Transcriptomic data indicated an enrichment of genes consistent with cardiac arrhythmias. MBCD removal reversed the arrhythmic phenotype, resulting in synchronicity despite not resolving fibrosis. This innovative & reliable human-relevant 3D acquired arrhythmia model shows potential for improving our understanding of arrhythmic action potential conduction and furthering therapeutic development. STATEMENT OF SIGNIFICANCE: This work describes a 3D human model of cardiac arrhythmia-on-a-chip with high reproducibility, fidelity, and extensive functional applicability. To mimic in vivo conditions, human induced pluripotent stem cell-derived cardiomyocytes (hiPSC-CMs) and cardiac fibroblasts from healthy controls were combined in a biocompatible fibrin hydrogel and seeded between two deflectable polymeric rods. Using the innate functional properties of this 3D model as well as advanced optical imaging techniques we demonstrated dramatic changes in contraction rate, synchronicity, and electrophysiological conduction in arrhythmic tissues relative to controls. Taken together, these data demonstrate the distinctive potential of this new model for pathophysiological studies, and for arrhythmia drug testing applications.",Acta biomaterialia,2021 Sep 15,"Journal Article; Research Support, Non-U.S. Gov't",S1742-7061(21)00145-8,https://pubmed.ncbi.nlm.nih.gov/33713861/,
