PMID,Title,Abstract,Journal,Date,Types,DOI,PubMed_Link,PMC_Link
30769137,"Microgels: Modular, tunable constructs for tissue regeneration.","Biopolymer microgels are emerging as a versatile tool for aiding in the regeneration of damaged tissues due to their biocompatible nature, tunable microporous structure, ability to encapsulate bioactive factors, and tailorable properties such as stiffness and composition. These properties of microgels, along with their injectability, have allowed for their utilization in a multitude of different tissue engineering applications. Controlled release of growth factors, antibodies, and other bioactive factors from microgels have demonstrated their capabilities as transporters for essential bioactive molecules necessary for guiding tissue reconstruction. Additionally, recent in vitro studies of cellular interaction and proliferation within microgel structures have laid the initial groundwork for regenerative tissue engineering using these materials. Microgels have even been crosslinked together in various ways or 3D printed to form three-dimensional scaffolds to support cell growth. In vivo studies of microgels have pioneered the clinical relevance of these novel and innovative materials for regenerative tissue engineering. This review will cover recent developments and research of microgels as they pertain to bioactive factor release, cellular interaction and proliferation in vitro, and tissue regeneration in vivo. STATEMENT OF SIGNIFICANCE: This review is focused on state-of-the-art microgel technology and innovations within the tissue engineering field, focusing on the use of microgels in bioactive factor delivery and as cell-interactive scaffolds, both in vitro and in vivo. Microgels are hydrogel microparticles that can be tuned based on the biopolymer from which they are derived, the crosslinking chemistry used, and the fabrication method. The emergence of microgels for tissue regeneration applications in recent years illuminates their versatility and applicability in clinical settings.",Acta biomaterialia,2019 Apr 1,"Journal Article; Research Support, N.I.H., Extramural; Review",S1742-7061(19)30115-1,https://pubmed.ncbi.nlm.nih.gov/30769137/,
30550934,Self-assembled GFFYK peptide hydrogel enhances the therapeutic efficacy of mesenchymal stem cells in a mouse hindlimb ischemia model.,"Mesenchymal stem cell (MSC) transplantation has emerged as a very promising strategy for the treatments of peripheral artery disease (PAD). However, MSC-based therapies are limited by low cell retention and survival rate in the ischemic zone. Small molecular (SM) hydrogels have shown attractive abilities to enhance the therapeutic effects of human MSCs via promoting their proliferation or maintaining their differentiation potential. Here, we designed and synthesized a new bioactive and biocompatible hydrogel, Nap-GFFYK-Thiol, using disulfide bonds as cleavable linkers to control the molecular self-assembly and we hypothesized this hydrogel could enhance the retention and engraftment of human placenta-derived MSCs (hP-MSCs) in a mouse ischemic hindlimb model. In vitro results demonstrated that the Nap-GFFYK-Thiol hydrogel increased cell viability through paracrine effects. Moreover, it enhanced the proangiogenic and anti-apoptotic effects of hP-MSCs. In vivo, Nap-GFFYK-Thiol hydrogel improved the hP-MSC retention in the murine ischemic hindlimb model as visualized by bioluminescence imaging. Furthermore, cotransplantation of hP-MSCs with hydrogel improved blood perfusion, leading to superior limb salvage. These therapeutic effects may attribute to reduced inflammatory cell infiltration, enhanced angiogenesis as well as suppressed collagen deposition. In conclusion, the Nap-GFFYK-Thiol hydrogel fabricated using disulfide bonds as cleavable linkers serves as an artificial niche for promoting hP-MSC survival and proangiogenic factor secretion in PAD therapy and thereby provide an alternative strategy for PAD therapy. STATEMENT OF SIGNIFICANCE: Although several phase I/II clinical trials of MSC-based treatments for critical limb ischemia (CLI) are ongoing, MSC-based therapies are still challenged by the low quality and quantity of cells in the ischemic zone, especially in cases of extensive or irreversible damage. Hydrogels have favorable biocompatibility and safety records in the medical field. In the current study, we engineered a new bioactive and biocompatible hydrogel, Nap-GFFYK-Thiol, using disulfide bonds as cleavable linkers to enhance the therapeutic efficacy of human placenta-derived MSCs (hP-MSCs) in mouse limb ischemia model. Notably, Nap-GFFYK-Thiol hydrogel acts as an artificial niche for promoting hP-MSC survival and proangiogenic factor secretion in PAD therapy, which further promoted the restoration of blood perfusion and regeneration of muscle cells. Considering the proangiogenic effect of Nap-GFFYK-Thiol on hP-MSCs, our results may provide a new strategy for the treatment of PAD.",Acta biomaterialia,2019 Feb,"Journal Article; Research Support, Non-U.S. Gov't",S1742-7061(18)30740-2,https://pubmed.ncbi.nlm.nih.gov/30550934/,
30476581,Porous scaffolds from droplet microfluidics for prevention of intrauterine adhesion.,"Severe intrauterine adhesions (IUAs) have a great negative impact on women's psychological and reproductive health. It remains a significant challenge to prevent postoperative IUAs because of the complications of various clinical preventive measures and incompatibility of uterine cavity morphology. Herein, we present a new drug-loadedporous scaffold based on a microfluidic droplet template, which combines the characteristics of the artificial biocompatible material GelMA and the natural polysaccharide material Na-alginate. By changing the containers that collect the microfluidic droplets, the porous scaffold conforming to the shape of the uterine cavity could be obtained. The porous structure, mechanical property, and flexibility impart the scaffold with compressibility and send it to the uterus through the vagina. In addition, the external-internal connected open structures could load and control the release of drugs to repair the damaged region continuously in vivo. To verify the antiadhesion and repair of drug-loaded porous scaffolds, we tested the system in the rat model of IUAs, and it was demonstrated that the system had the ability to improve neovascularization, cellularize the damaged tissue, and repair the endometrium. These features provide the drug-loaded porous scaffolds with new options for the improvement of postoperative IUAs. STATEMENT OF SIGNIFICANCE: Intrauterine adhesions are caused by various causes of damage to the endometrial basal layer, thus leading to part or entire adhesions in the cervical or uterine cavity. Clinically, various preventive measures reach the barrier effect through the physical barrier, which are difficult to further promote the repair of the damaged endometrium, and most of them have apparent side effects. This study aims to prepare compressible and biodegradable three-dimensional porous drug-loading biological scaffolds. GelMA and Na-alginate have desirable biocompatibility. The interconnect porous scaffolds, which were prepared through the combination of biomaterials and single emulsion microfluidics, not only have compressibility but also provide space for drug delivery and release. This system can further promote the repair of the endometrium while preventing adhesion.",Acta biomaterialia,2019 Jan 15,"Journal Article; Research Support, Non-U.S. Gov't",S1742-7061(18)30670-6,https://pubmed.ncbi.nlm.nih.gov/30476581/,
30414483,Biomaterials and glia: Progress on designs to modulate neuroinflammation.,"Microglia are multi-functional cells that play a vital role in establishing and maintaining the function of the nervous system and determining the fate of neurons following injury or neuropathology. The roles of microglia are diverse and essential to the capacity of the nervous system to recover from injury, however sustained inflammation can limit recovery and drive chronic disease processes such as neurodegenerative disorders. When assessing implantable therapeutic devices in the central nervous system, an improved lifetime of the implant is considered achievable through the attenuation of microglial inflammation. Consequently, there is a tremendous underexplored potential in biomaterial and engineered design to modulate neuroinflammation for therapeutic benefit. Several strategies for improving device compatibility reviewed here include: biocompatible coatings, improved designs in finer and flexible shapes to reduce tissue shear-related scarring, and loading of anti-inflammatory drugs. Studies about microglial cell cultures in 3D hydrogels and nanoscaffolds to assess various injuries and disorders are also discussed. A variety of other microglia-targeting treatments are also reviewed, including nanoparticulate systems, cellular backpacks, and gold plinths, with the intention of delivering anti-inflammatory drugs by targeting the phagocytic nature of microglia. Overall, this review highlights recent advances in biomaterials targeting microglia and inflammatory function with the potential for improving implant rejection and biocompatibility studies. STATEMENT OF SIGNIFICANCE: Microglia are the resident immune cells of the central nervous system, and thus play a central role in the neuroinflammatory response against conditions than span acute injuries, neuropsychiatric disorders, and neurodegenerative disorders. This review article presents a summary of biomaterials research that target microglia and other glial cells in order to attenuate neuroinflammation, including but not limited to: design of mechanically compliant and biocompatible stimulation electrodes, hydrogels for high-throughput 3D modelling of nervous tissue, and uptake of nanoparticle drug delivery systems. The goal of this paper is to identify strengths and gaps in the relevant literature, and to promote further consideration of microglia behaviour and neuroinflammation in biomaterial design.",Acta biomaterialia,2019 Jan 1,"Journal Article; Research Support, Non-U.S. Gov't; Review",S1742-7061(18)30662-7,https://pubmed.ncbi.nlm.nih.gov/30414483/,
30366132,Gallol-derived ECM-mimetic adhesive bioinks exhibiting temporal shear-thinning and stabilization behavior.,"3D bioprinting is an attractive technique to fabricate well-organized, cell-laden constructs for tissue repair and disease modeling. Although numerous hydrogel bioinks have been developed, materials are still needed that mimic the cellular microenvironment, have the appropriate viscosity and stabilization for printing, and are cytocompatible. Here, we present a unique gallol-modified extracellular matrix (ECM) hydrogel ink that is inspired by rapid fruit browning phenomena. The gallol-modification of ECM components (e.g., hyaluronic acid, gelatin) allowed (i) immediate gelation and shear-thinning properties by dynamic hydrogen bonds on short time-scales and (ii) further auto-oxidation and covalent crosslinking for stabilization on longer time-scales. The gallol ECM hydrogel ink was printable using an extrusion-based 3D printer by exploiting temporal shear-thinning properties, and further showed cytocompatibility ( approximately 95% viability) and on-tissue printability due to adhesiveness of gallol moieties. Printed cell-laden filaments degraded and swelled with culture over 6days, corresponding to increases in cell density and spreading. Ultimately, this strategy is useful for designing hydrogel inks with tunable properties for 3D bioprinting. STATEMENT OF SIGNIFICANCE: 3D bioprinting is a promising technique for the fabrication of cell-laden constructs for applications as in vitro models or for therapeutic applications. Despite the previous development of numerous hydrogel bioinks, there still remain challenging considerations in the design of bioinks. In this study, we present a unique cytocompatible hydrogel ink with gallol modification that is inspired by rapid fruit browning phenomena. The gallol hydrogel ink has three important properties: i) it shows immediate gelation by dynamic, reversible bonds for shear-thinning extrusion, ii) it allows spontaneous stabilization by subsequent covalent crosslinking after printing, and iii) it is printable on tissues by adhesive properties of gallol moieties. As such, this work presents a new approach in the design of hydrogel inks.",Acta biomaterialia,2019 Sep 1,"Journal Article; Research Support, Non-U.S. Gov't; Research Support, U.S. Gov't, Non-P.H.S.",S1742-7061(18)30627-5,https://pubmed.ncbi.nlm.nih.gov/30366132/,
29398644,Microgels produced using microfluidic on-chip polymer blending for controlled released of VEGF encoding lentivectors.,"Alginate hydrogels are widely used as delivery vehicles due to their ability to encapsulate and release a wide range of cargos in a gentle and biocompatible manner. The release of encapsulated therapeutic cargos can be promoted or stunted by adjusting the hydrogel physiochemical properties. However, the release from such systems is often skewed towards burst-release or lengthy retention. To address this, we hypothesized that the overall magnitude of burst release could be adjusted by combining microgels with distinct properties and release behavior. Microgel suspensions were generated using a process we have termed on-chip polymer blending to yield composite suspensions of a range of microgel formulations. In this manner, we studied how alginate percentage and degradation relate to the release of lentivectors. Whereas changes in alginate percentage had a minimal impact on lentivector release, microgel degradation led to a 3-fold increase, and near complete release, over 10days. Furthermore, by controlling the amount of degradable alginate present within microgels the relative rate of release can be adjusted. A degradable formulation of microgels was used to deliver vascular endothelial growth factor (VEGF)-encoding lentivectors in the chick chorioallantoic membrane (CAM) assay and yielded a proangiogenic response in comparison to the same lentivectors delivered in suspension. The utility of blended microgel suspensions may provide an especially appealing platform for the delivery of lentivectors or similarly sized therapeutics. STATEMENT OF SIGNIFICANCE: Genetic therapeutics hold considerable potential for the treatment of diseases and disorders including ischemic cardiovascular diseases. To realize this potential, genetic vectors must be precisely and efficiently delivered to targeted regions of the body. However, conventional methods of delivery do not provide sufficient spatial and temporal control. Here, we demonstrate how alginate microgels provide a basis for developing systems for controlled genetic vector release. We adjust the physiochemical properties of alginate for quicker or slower release, and we demonstrate how combining distinct formulations of microgels can tune the release of the overall composite microgel suspension. These composite suspensions are generated using a straightforward and powerful application of droplet microfluidics which allows for the real-time generation of a composite suspension.",Acta biomaterialia,2018 Mar 15,"Journal Article; Research Support, N.I.H., Extramural; Research Support, Non-U.S. Gov't",S1742-7061(18)30024-2,https://pubmed.ncbi.nlm.nih.gov/29398644/,
29281806,Stem cell-inspired secretome-rich injectable hydrogel to repair injured cardiac tissue.,"The objective of this study was to develop an injectable and biocompatible hydrogel that can deliver a cocktail of therapeutic biomolecules (secretome) secreted by human adipose-derived stem cells (hASCs) to the peri-infarct myocardium. Gelatin and Laponite(R) were combined to formulate a shear-thinning, nanocomposite hydrogel (nSi Gel) as an injectable carrier of secretome (nSi Gel+). The growth factor composition and the pro-angiogenic activity of the secretome were tested in vitro by evaluating the proliferation, migration and tube formation of human umbilical endothelial cells. The therapeutic efficacy of the nSi Gel+system was then investigated in vivo in rats by intramyocardial injection into the peri-infarct region. Subsequently, the inflammatory response, angiogenesis, scar formation, and heart function were assessed. Biocompatibility of the developed nSi Gel was confirmed by quantitative PCR and immunohistochemical tests which showed no significant differences in the level of inflammatory genes, microRNAs, and cell marker expression compared to the untreated control group. In addition, the only group that showed a significant increase in capillary density, reduction in scar area and improved cardiac function was treated with the nSi Gel+. Our in vitro and in vivo findings demonstrate the potential of this new secretome-loaded hydrogel as an alternative strategy to treat myocardial infarction. STATEMENT OF SIGNIFICANCE: Stem cell based-therapies represent a possible solution to repair damaged myocardial tissue by promoting cardioprotection, angiogenesis, and reduced fibrosis. However, recent evidence indicates that most of the positive outcomes are likely due to the release of paracrine factors (cytokines, growth factors, and exosomes) from the cells and not because of the local engraftment of stem cells. This cocktail of essential growth factors and paracrine signals is known as secretome can be isolated in vitro, and the biomolecule composition can be controlled by varying stem-cell culture conditions. Here, we propose a straightforward strategy to deliver secretome produced from hASCs by using a nanocomposite injectable hydrogel made of gelatin and Laponite(R). The designed secretome-loaded hydrogel represents a promising alternative to traditional stem cell therapy for the treatment of acute myocardial infarction.",Acta biomaterialia,2018 Mar 15,"Journal Article; Research Support, N.I.H., Extramural; Research Support, Non-U.S. Gov't",S1742-7061(17)30791-2,https://pubmed.ncbi.nlm.nih.gov/29281806/,
28532899,"Nanodiamond-based injectable hydrogel for sustained growth factor release: Preparation, characterization and in vitro analysis.","Nanodiamonds (NDs) represent an emerging class of carbon nanomaterials that possess favorable physical and chemical properties to be used as multifunctional carriers for a variety of bioactive molecules. Here we report the synthesis and characterization of a new injectable ND-based nanocomposite hydrogel which facilitates a controlled release of therapeutic molecules for regenerative applications. In particular, we have formulated a thermosensitive hydrogel using gelatin, chitosan and NDs that provides a sustained release of exogenous human vascular endothelial growth factor (VEGF) for wound healing applications. Addition of NDs improved the mechanical properties of the injectable hydrogels without affecting its thermosensitive gelation properties. Biocompatibility of the generated hydrogel was verified by in vitro assessment of apoptotic gene expressions and anti-inflammatory interleukin productions. NDs were complexed with VEGF and the inclusion of this complex in the hydrogel network enabled the sustained release of the angiogenic growth factor. These results suggest for the first time that NDs can be used to formulate a biocompatible, thermosensitive and multifunctional hydrogel platform that can function both as a filling agent to modulate hydrogel properties, as well as a delivery platform for the controlled release of bioactive molecules and growth factors. STATEMENT OF SIGNIFICANCE: One of the major drawbacks associated with the use of conventional hydrogels as carriers of growth factors is their inability to control the release kinetics of the loaded molecules. In fact, in most cases, a burst release is inevitable leading to diminished therapeutic effects and unsuccessful therapies. As a potential solution to this issue, we hereby propose a strategy of incorporating ND complexes within an injectable hydrogel matrix. The functional groups on the surface of the NDs can establish interactions with the model growth factor VEGF and promote a prolonged release from the polymer network, therefore, providing a longer therapeutic effect. Our strategy demonstrates the efficacy of using NDs as an essential component for the design of a novel injectable nanocomposite system with improved release capabilities.",Acta biomaterialia,2017 Aug,"Journal Article; Research Support, N.I.H., Extramural",S1742-7061(17)30307-0,https://pubmed.ncbi.nlm.nih.gov/28532899/,
28501713,An in situ photocrosslinkable platelet rich plasma - Complexed hydrogel glue with growth factor controlled release ability to promote cartilage defect repair.,"The repair of articular cartilage injury is a great clinical challenge. Platelet-rich plasma (PRP) has attracted much attention for the repair of articular cartilage injury, because it contains various growth factors that are beneficial for wound repair. However, current administration methods of PRP have many shortcomings, such as unstable biological fixation and burst release of growth factors, all of which complicate its application in the repair of articular cartilage and compromise its therapeutic efficacy. In this study, based on our previously reported photoinduced imine crosslinking (PIC) reaction, we developed an in situ photocrosslinkable PRP hydrogel glue (HNPRP) through adding a photoresponsive hyaluronic acid (HA-NB) which could generate aldehyde groups upon light irradiation and subsequently react with amino groups, into autologous PRP. Our study showed that HNPRP hydrogel glue was cytocompatible and could be conveniently and rapidly prepared in situ, forming a robust hydrogel scaffold. In addition, our results demonstrated that HNPRP hydrogel not only achieved controlled release of growth factors, but also showed strong tissue adhesive ability. Therefore, HNPRP hydrogel was quite suitable for cartilage defect regeneration. Our further in vitro experiment showed that HNPRP hydrogel could promote the proliferation and migration of chondrocytes and bone marrow stem cells (BMSCs). In vivo testing using a rabbit full-thickness cartilage defect model demonstrated that HNPRP hydrogel could achieve integrative hyaline cartilage regeneration and its therapeutic efficacy was better than thrombin activated PRP gel. STATEMENT OF SIGNIFICANCE: In this study, we have developed a photocrosslinkable platelet rich plasma (PRP) - complexed hydrogel glue (HNPRP) for cartilage regeneration. The in situ formed HNPRP hydrogel glue showed not only the controlled release ability of growth factors, but also strong tissue adhesiveness, which could resolve the current problems in clinical application of PRP. Furthermore, HNPRP hydrogel glue could promote integrative hyaline cartilage regeneration, and its reparative efficacy for cartilage defect was better than thrombin activated PRP gel. This study provided not only an effective repair material for cartilage regeneration, but also developed an advanced method for PRP application.",Acta biomaterialia,2017 Oct 15,Journal Article,S1742-7061(17)30303-3,https://pubmed.ncbi.nlm.nih.gov/28501713/,
28069504,pH-sensitive peptide hydrogel for glucose-responsive insulin delivery.,"Glucose-responsive system is one of important options for self-regulated insulin delivery to treat diabetes, which has become an issue of great public health concern in the world. In this study, we developed a novel and biocompatible glucose-responsive insulin delivery system using a pH-sensitive peptide hydrogel as a carrier loaded with glucose oxidase, catalase and insulin. The peptide could self-assemble into hydrogel under physiological conditions. When hypoglycemia is encountered, neighboring alkaline amino acid side chains are significantly repulsed due to reduced local pH by the enzymatic conversion of glucose into gluconic acid. This is followed by unfolding of individual hairpins, disassembly and release of insulin. The glucose-responsive hydrogel system was characterized on the basis of structure, conformation, rheology, morphology, acid-sensitivity and the amount of consistent release of insulin in vitro and vivo. The results illustrated that our system can not only regulate the blood glucose levels in vitro but also in mice models having STZ-induced diabetes. STATEMENT OF SIGNIFICANCE: In this report, we have shown the following significance supported by the experimental results. 1. We successfully developed, characterized and screened a novel pH-responsive peptide. 2. We successfully developed a novel and biocompatible pH-sensitive peptide hydrogel as glucose-responsive insulin delivery system loaded with glucose oxidase, catalase and insulin. 3. We successfully confirmed that the hydrogel platform could regulate the blood glucose level in vitro and in vivo. Overall, we have shown enough significance and novelty with this smart hydrogel platform in terms of biomaterials, peptide chemistry, self-assembly, hydrogel and drug delivery. So we believe this manuscript is suitable for Acta Biomaterialia.",Acta biomaterialia,2017 Mar 15,"Journal Article; Research Support, Non-U.S. Gov't",S1742-7061(17)30016-8,https://pubmed.ncbi.nlm.nih.gov/28069504/,
